city,hotel_name,score,description,latitude,longitude,temperature,humidity
Lille,Old Lille - Beautiful house 3 bdrms 7pers,7.6,"In the Vieux Lille district of Lille, close to Lille Opera, Old Lille - Beautiful house 3 bdrms 7pers features free WiFi and a washing machine. ",50.641552,3.062729,2,84
Lille,ibis Styles Lille Centre Gare Beffroi,7.8,"The ibis Styles Lille Centre Gare Beffroi is located in the centre of Lille, 600 metres from Lille Flandres and Lille Europe train stations. ",50.63238245,3.06794286,2,84
Lille,Appart'City Confort Lille - Euralille,8.1,"This Appart'city is 10 km from Pierre Mauroy Stadium and 2 minutes by tramway from the centre of Euralille business district, Euralille shopping centre and Lille-Europe Train Station. ",50.6454875,3.07321072,2,84
Lille,Lille Grand Place - cozy and equipped studio!,8.1,"Situated in Lille, Lille Grand Place - cozy and equipped studio! features city views and free WiFi, 400 metres from Grand Place Lille and 400 metres from Lille Opera. ",50.6349198,3.0671957,2,84
Lille,Séjours & Affaires Lille Europe,7.1,"This residence is located in the city centre of Lille, in the heart of the business district and between Lille-Flandres and Lille-Europe Train Stations, less than 600 metres from each. ",50.63647023,3.07490923,2,84
Lille,Hotel Lille Europe,7.9,"Located just 250 metres from Lille-Flandres Train Station, this 3-star hotel is set at the heart of the international business district. Pierre Mauroy Stadium is a 17-minute drive away. ",50.63788756,3.072685,2,84
Lille,Moxy Lille City,8.6,"Located in Lille, 300 metres from Coilliot House, Moxy Lille City provides accommodation with a terrace and private parking. ",50.627831,3.063592,2,84
Rouen,Hôtel De La Cathédrale,7.8,"Set just 50 metres from the Rouen Cathedral, in the heart of the city's historic centre, this hotel has a timber-framed façade dating from the 17th century and is located 4 km from the Kindarena...",49.44011681,1.09693363,2,87
Lille,Eklo Hotels Lille,7.5,"Offering a terrace, Eklo Hotels Lille is set in Lille in the Nord-Pas-de-Calais Region, 2 km from Zénith of Lille. ",50.62003296,3.08456697,2,84
Rouen,Appart'HomeCity - Rouen Grand Voile,8.5,Managed by a private host,49.42540118,1.06979833,2,87
Lille,Hotel Chagnot,7.8,"Hotel Chagnot is situated in Lille city centre, directly opposite Lille Flanders Train Station and a 10-minute walk from Lille-Europe Station. It offers modern accommodation and free Wi-Fi access. ",50.63624596,3.06924239,2,84
Rouen,Bel appartement dans le centre historique de Rouen,8.3,Managed by a private host,49.4441468,1.0906474,2,87
Rouen,Hôtel Céline - Hôtel de la Gare,8.0,"This hotel is situated in a quiet street in the city centre of Rouen, a 5-minute walk from Rouen-Rive Droite Train Station. Free Wi-Fi is available in all of the rooms. ",49.44903352,1.09021068,2,87
St Malo,LES AMARRES - Maison familiale 3 chambres - Jardin et place de parking,9.2,"Situated in Saint Malo, 1.9 km from Rochebonne Beach, 2.5 km from Eventail Beach and 2.3 km from Palais du Grand Large, LES AMARRES - Maison familiale 3 chambres - Jardin et place de parking features...",48.6476829,-1.9952037,5,80
Rouen,CosyAppart - LE SAINT OUEN,7.8,"CosyAppart - LE SAINT OUEN in Rouen offers accommodation with free WiFi, less than 1 km from Notre-Dame Cathedral of Rouen, a 12-minute walk from Gare de Rouen Rive Droite and 3.9 km from Rouen...",49.44369966,1.10166196,2,87
Rouen,"Le First, centre ville terrasse et parking",9.0,Managed by a private host,49.4460252,1.0832305,2,87
Rouen,Fiquet de Normanville pour votre bien être en plein coeur historique,9.2,Managed by a private host,49.44244414,1.09804968,2,87
Rouen,La Loge d'Harcourt : Hypercentre chic et moderne,7.9,Managed by a private host,49.44081037,1.08509756,2,87
Rouen,Hotel Morand,7.3,"Hotel Morand is a renovated 17th-century coaching inn that now works as a hotel and is located in the historic centre of Rouen, 400 metres from Saint-Paul SNCF Train Station. ",49.44569975,1.094523,2,87
Lille,Welkeys - Vauban Apartment,8.0,"Just 600 metres from Zoo Park of Lille and 800 metres from Braderie Lille and featuring free WiFi, Welkeys - Vauban Apartment offers accommodation in Lille. ",50.632701,3.047162,2,84
Rouen,Brit Hotel Confort Rouen Centre,7.4,"This hotel is located in the centre of Rouen next to the University of Rouen Faculty Of Medicine and 4 km from the Kindarena Stadium. It offers en suite rooms, a terrace and free WiFi access. ",49.43869536,1.1092034,2,87
Rouen,studi'home,8.3,Managed by a private host,49.443658,1.090557,2,87
Rouen,"Hôtel de Bourgtheroulde, Autograph Collection",8.4,"This boutique hotel is located in Rouen’s historic centre, next to the Gros Horloge and 2 km from Kindarena Stadium. ",49.442178,1.088876,2,87
Rouen,Best Western Plus Hotel Litteraire Gustave Flaubert,8.5,"Situated in the historic centre of Rouen, Best Western Plus Hotel Litteraire Gustave Flaubert offers accommodation with a literary theme in honour of the writer Gustave Flaubert. ",49.44306423,1.08660311,2,87
Rouen,"Holiday Inn Express - Rouen Centre - Rive Gauche, an IHG Hotel",8.3,"Situated in Rouen, 1.7 km from Voltaire Station, Rouen, Holiday Inn Express - Rouen Centre - Rive Gauche, an IHG Hotel features accommodation with a bar, private parking and a shared lounge. ",49.429988,1.072398,2,87
Rouen,Maison individuelle dans ancienne ecurie,9.4,Managed by a private host,49.4502479,1.0864592,2,87
Rouen,Ibis Styles Rouen Centre Cathédrale,7.2,"Featuring free WiFi and a terrace, Ibis Styles Rouen Centre Cathédrale offers pet-friendly accommodation in Rouen, 1.6 km from Rouen Train Station and 3 km from Rouen Kindarena Sports Hall. ",49.437454,1.096183,2,87
Rouen,Cosy'Appart - LA ROSE,7.9,"Cosy'Appart - LA ROSE in Rouen offers accommodation with free WiFi, 1.9 km from Gare de Rouen Rive Droite, 1.6 km from Notre-Dame Cathedral of Rouen and 3.4 km from Voltaire Station, Rouen. ",49.443319,1.1115865,2,87
Rouen,Hotel De Quebec,8.2,"Located in the heart of Rouen, in a peaceful area only a 5-minute walk from the old town and Rouen Cathedral, this hotel includes free Wi-Fi internet access. The Kindarena Stadium is 3 km away. ",49.43783419,1.09725282,2,87
Rouen,DOMITYS Les Mosaïques,8.9,"With Voltaire Station, Rouen reachable in 1 km, DOMITYS Les Mosaïques offers accommodation, a restaurant, a bar, a shared lounge and a garden. ",49.4290146,1.0832807,2,87
Rouen,Les Initiés,8.0,"Located in the heart of Rouen's historical centre, Les Initiés is just a 10-minute walk from Rouen-Rive-Droite Train Station and 3 km from Kindarena Stadium. ",49.44197641,1.09243892,2,87
Rouen,Mercure Rouen Centre Cathédrale,8.1,"This Mercure is located in central Rouen, 160 metres from Notre Dame Cathedral and 3 km from Kindarena Stadium. ",49.44117285,1.09517545,2,87
Rouen,Maison hypercentre Rouen tout confort,8.6,Managed by a private host,49.4446518,1.0913262,2,87
Rouen,"Radisson Blu Hotel, Rouen Centre",8.9,"Radisson Blu Hotel, Rouen Centre features a restaurant serving high qualtiy local dishes, fitness centre, a bar and shared lounge in Rouen. ",49.446441,1.09412,2,87
Rouen,Médié Lounge - Médié Old - by Beds76,9.0,"Médié Lounge - Médié Old - by Beds76 features garden views, free WiFi and free private parking, located in Rouen, 600 metres from Notre-Dame Cathedral of Rouen. ",49.4416755,1.1006621,2,87
Rouen,Le Vieux Carré,8.1,"This hotel is located in central Rouen, in a pedestrian area, just 850 metres from Rouen Rive-Droite Station. It offers en suite rooms and an interior courtyard with flowers and trees. ",49.44332714,1.09457396,2,87
Le Havre,Foch,8.9,"Offering garden views, a casino and free WiFi, Foch offers accommodation in a prime location in Le Havre, within a short distance of Le Havre Beach, Perret Model Appartment and Le Volcan. ",49.4930727,0.1022734,5,80
Le Havre,"Le petit nid perché sous les toits, vue mer",,Managed by a private host,49.4972341,0.0947022,5,80
Le Havre,Oscar Hôtel,7.6,"Oscar Hotel is located in Le Havre's Perret quarter, which is a UNESCO World Heritage Site. It offers free Wi-Fi and views of The Volcan concert venue and the Bassin du Commerce. ",49.48981028,0.10710865,5,80
Le Havre,Residence Hoteliere de l'Estuaire,7.0,"Featuring free WiFi throughout the property, Residence Hoteliere de l'Estuaire is situated in Le Havre, 500 metres from Saint-Michel's Church. ",49.4955557,0.116637,5,80
Le Havre,Residence Monet- F2 à deux pas de toutes commodités,8.0,"Set in Le Havre, 1.8 km from Le Havre Beach, Residence Monet- F2 à deux pas de toutes commodités offers accommodation with a bar, free WiFi, a 24-hour front desk, and a concierge service. ",49.4936742,0.1164884,5,80
Le Havre,Séjour chez le Marin,7.8,"Located 2.5 km from Perret Model Appartment, 3 km from Saint-Michel's Church and 3.2 km from Eglise St-Joseph, Séjour chez le Marin provides accommodation set in Le Havre. ",49.4845138,0.1325153,5,80
Le Havre,Le Petit Coeur,7.3,Managed by a private host,49.4938936,0.1156005,5,80
Le Havre,La Petite Rade Hôtel,8.2,"Located in Le Havre, this hotel is just a few steps from the coast and offers panoramic sea views. It provides direct beach access and free Wi-Fi. ",49.50238471,0.08598089,5,80
Le Havre,Hôtel Carmin,8.3,"Hôtel Carmin is located in Le Havre town centre, 700m from the HAVRE beach It offers en suite rooms and free Wi-Fi. Rooms at the Carmin are equipped with a telephone and a flat-screen TV. ",49.49493852,0.10553956,5,80
Le Havre,Résidence Dauphine,7.5,Résidence Dauphine offers pet-friendly accommodation in Le Havre's historic district. Many restaurants and shops can be found within 150 metres. The beach and the marina are within a 10-minute walk. ,49.48800663,0.11446936,5,80
Le Havre,Hôtel Spa Vent d'Ouest,8.0,"Located just 550 metres from the beach in Le Havre, this hotel is a 5-minute drive from the ferry terminal. ",49.49141928,0.10070756,5,80
Le Havre,Best Western Plus Le Havre Centre Gare,8.4,"Located in central Le Havre, Best Western Plus Le Havre Centre Gare is a 4 star design hotel offering free WiFi just 10 minutes' drive from the beach. ",49.49334357,0.12431771,5,80
Le Havre,Birgit Hôtel Le Havre Centre,8.0,"Welcome to Birgit! When visiting Le Havre, there is nothing better than to stay in this 86-room hotel, completely renovated in 2022. ",49.49308921,0.13096154,5,80
Le Havre,Mercure Le Havre Centre Bassin Du Commerce,7.6,"Mercure Le Havre Centre Bassin du Commerce is located in Le Havre’s city centre, opposite the Bassin du Commerce and near ferry-port. ",49.49033645,0.11681288,5,80
Le Havre,Nomad Hotel le Havre,8.4,Nomad Hotel le Havre is located in Le Havre and offers air-conditioned rooms with free WiFi access and a modern-style decor. Guests can enjoy the on-site bar. ,49.4933176,0.12530688,5,80
Le Havre,L'Atelier d'Oscar,8.4,Managed by a private host,49.491319,0.1157516,5,80
Le Havre,Hotel Spa Le Pasino,8.4,"Located at the heart of Le Havre, Hotel Spa le Pasino features an indoor swimming pool, a spa with sauna and a casino on site. It offers guest rooms with a flat-screen TV. ",49.49117449,0.11193663,5,80
Le Havre,Premiere Classe Le Havre Centre-LES DOCKS,7.6,Magnificent Première Classe Le Havre Centre-Les Docks; ideally located near the Océane stadium and the docks. We offer a personalized reception 24/24 with private and secure parking. ,49.49641693,0.15151234,5,80
Le Havre,Odalys City Le Havre Centre Gare,8.7,"Situated in Le Havre, near Le Volcan, Perret Model Appartment and Saint-Michel's Church, Odalys City Le Havre Centre Gare features free WiFi. ",49.49190808,0.12316179,5,80
Le Havre,Holiday Inn Express - Le Havre Centre,8.2,"Our hotel, located in Le Havre downtown and at 600 meters from the SNCF train station, welcomes you for a professional and leisure stay. ",49.498238,0.128837,5,80
Bayeux,Novotel Bayeux,7.6,The Novotel Bayeux is situated between Caen and Cherbourg in Normandy. It is just 1 km away from the famous Bayeux Tapestry and the historic town centre. ,49.28176922,-0.71848869,5,81
Bayeux,"La Naomath - Maison d'hôtes, Hébergement insolite & Gîte",8.3,"Located just 6 km from the centre of Bayeux, La Naomath offers B&B accommodation in it's restored stone house, a self-catering cottage and a cabin surrounded by well-established gardens. ",49.24770809,-0.65629363,5,81
Bayeux,Château Saint Gilles,9.5,"Situated in Bayeux, 4.6 km from Baron Gerard Museum, Château Saint Gilles features accommodation with a restaurant, free private parking, a seasonal outdoor swimming pool and a bar. ",49.249366,-0.712469,5,81
Le Havre,Le Richelieu,6.8,"Located between the town hall and the cathedral, Hotel Le Richelieu is located in the heart of Le Havre, just a 10-minute walk from the beach and 24 km from Honfleur. ",49.48881105,0.10760218,5,80
Bayeux,Villa Lara Hotel,9.6,Villa Lara is a small luxury boutique hotel in the historic centre of Bayeux. It faces the 11th-century cathedral is is just a 2-minute walk from the Bayeux Tapestry. ,49.27551886,-0.70096448,5,81
Bayeux,La cour des teinturiers,9.4,Managed by a private host,49.2768198,-0.7001433,5,81
Bayeux,Au Loup Historic Apartments,8.4,"Located 550 metres of Cathedrale Notre Dame de Bayeux and a 10-minute walk of Museum of the Bayeux Tapestry in Bayeux, Au Loup Historic Apartments offers accommodation with free WiFi, a seating area,...",49.272798,-0.707556,5,81
Bayeux,Tiny house au cœur de Bayeux,9.8,Managed by a private host,49.2755584,-0.6992038,5,81
Bayeux,Manoir Sainte Victoire,9.6,"Offering garden views, a garden and free WiFi, Manoir Sainte Victoire offers accommodation well situated in Bayeux, within a short distance of Baron Gerard Museum, Cathedrale Notre Dame de Bayeux and...",49.27649171,-0.7057596,5,81
Bayeux,Villa Camélia,8.5,Managed by a private host,49.2799225,-0.7109249,5,81
Le Havre,"The Originals Boutique, Hôtel Le Marignan,Le Havre Centre Gare",8.0,"Set in Le Havre and with Le Havre Beach reachable within 2.3 km, The Originals Boutique, Hôtel Le Marignan, Le Havre Centre Gare offers express check-in and check-out, allergy-free rooms, a bar, free...",49.49227908,0.12310803,5,80
Bayeux,Grand Hôtel du Luxembourg et La Table du Grand Luxembourg,7.7,This 17th-century mansion has been converted into a charming hotel with a gastronomic restaurant and an outdoor heated pool which is accessible all year round. ,49.27842191,-0.70329666,5,81
Bayeux,Le Petit Matin,9.4,"This guest house is set in a building from the 18th century in Bayeux’s historical district. Le Petit Matin offers a garden, a furnished terrace. ",49.27606133,-0.70905536,5,81
Bayeux,Hôtel Le Bayeux,7.9,Hotel Le Bayeux is located in the historic centre of Bayeux in the Lower Normandy region. It offers en suite accommodation with free Wi-Fi internet access. ,49.27415914,-0.70450634,5,81
Bayeux,Chambre d'hôtes Logis de Saint Jean,9.0,"Located in the historic centre of Bayeux, just 350 metres from the tapestry museum, Chambre d'hôtes Logis de Saint Jean offers a courtyard with an outdoor seating area and a communal living room. ",49.27600709,-0.69828361,5,81
Bayeux,La Maison de Mathilde,8.9,"La Maison de Mathilde is set in Bayeux, 100 metres from Baron Gerard Museum and 200 metres from Museum of the Bayeux Tapestry. ",49.27647468,-0.70247008,5,81
Bayeux,"Hôtel particulier ""le clos de la croix""",9.8,"Offering garden views, Hôtel particulier ""le clos de la croix"" in Bayeux offers accommodation, a shared lounge, a garden and a terrace. Free WiFi is featured throughout the property. ",49.277964,-0.701677,5,81
Bayeux,Immolidays,8.1,Managed by a private host,49.27905535,-0.70856206,5,81
Bayeux,Hôtel De Brunville et La Table du Grand Luxembourg,7.9,"Just 400 metres from Bayeux Cathedral, this hotel offers a restaurant with a garden courtyard in the heart of the medieval town. ",49.27815769,-0.70351392,5,81
Bayeux,Hotel Reine Mathilde,8.4,"Hotel Reine Mathilde is situated in the medieval district, just 300 metres from the Bayeux Tapestry Museum. It offers free Wi-Fi access and modern guest rooms with private bathrooms. ",49.27603159,-0.70172489,5,81
Bayeux,L'AURE BLEUE,9.0,Managed by a private host,49.2772596,-0.699284,5,81
Bayeux,Château de Bellefontaine,8.1,"Located 800 metres from central Bayeux and its cathedral, this 18th-century mansion offers guest rooms and a traditional restaurant open for dinner upon reservation. ",49.26974024,-0.68883955,5,81
Bayeux,IKE'S Deluxe APARTMENT in Bayeux,8.0,Managed by a private host,49.279712,-0.70978,5,81
Bayeux,Clos de Bellefontaine B&B,9.7,"Set in a 2000m² park, this 19th-century house is just 200 metres from the Bayeux Tapestry. You can admire the views of the garden from your elegant room or visit Omaha Beach, 6 km away. ",49.27267164,-0.69486111,5,81
Bayeux,Grand appart - CENTRE HISTORIQUE - LUMINEUX - Bayeux - proche Omaha Beach,8.9,Managed by a private host,49.27814786,-0.7062653,5,81
Bayeux,Hotel Le Lion D'Or et Restaurant La Table Du Lion,8.7,This former 18th-century post office is now a charming hotel located in one of Bayeux’s oldest quarters. It offers 24-hour reception and is just 400 metres from the Bayeux Tapestry Museum. ,49.27627832,-0.69836944,5,81
Biarritz,Cosy 1br with terrace and parking in Biarritz 5 min to the beach - Welkeys,8.6,"Offering free WiFi and free private parking, Cosy 1br with terrace and parking in Biarritz 5 min to the beach - Welkeys is located in Biarritz, within just 400 metres of Cote des Basques Beach. ",43.4711003,-1.5661007,4,80
Biarritz,Large studio design w balcony at the heart of Biarritz - Welkeys,8.8,Managed by a private host,43.4826292,-1.560718,4,80
Biarritz,Sofitel Biarritz Le Miramar Thalassa,7.8,"Just a few steps from downtown Biarritz, the Sofitel Biarritz le Miramar overlooks one of the most beautiful beaches of the Basque Coast. ",43.48784796,-1.55444473,4,80
Toulouse,Residhotel Toulouse Centre,7.9,"Located in Toulouse, Residhotel Toulouse Centre is 900 metres from the Toulouse Museum and 500 metres from Palais de Justice Metro Station. It offers apartments and studios with free WiFi access. ",43.59539161,1.44120499,1,84
Toulouse,Citiz Hotel,7.8,"The 4-star Citiz Hotel is located on Place Wilson in Toulouse, a 5-minute walk from the Capitole and a 10-minute walk from Matabiau Train Station. ",43.60566998,1.4491117,1,84
Toulouse,Appart’City Confort Toulouse Aéroport Purpan,7.5,"Appart’City Confort Toulouse Aéroport Purpan is located a 10-minute drive from Place du Capitole in the city centre, and 6 km from Toulouse Stadium. ",43.59868349,1.39488816,1,84
Montauban,Kyriad Montauban Sud - Albasud,6.6,"Located near the A20 motorway, Kyriad Montauban Sud - Albasud is just 8 kilometres from Montauban's town centre and train station. It offers air-conditioned rooms and free WiFi access. ",43.98204027,1.33269846,0,85
Carcassonne,Entre Bastide et Cité,9.1,Managed by a private host,43.20816115,2.35398442,1,86
Aigues Mortes,Hotel L'Escale,8.1,"Set in Aigues-Mortes, within 23 km of Montpellier Arena and 23 km of Parc des Expositions de Montpellier, Hotel L'Escale offers accommodation with a restaurant and a bar, and free WiFi throughout the...",43.56879591,4.18808669,4,60
Aigues Mortes,Les Manades,8.7,Managed by a private host,43.5700838,4.1911109,4,60
Nímes,Hôtel Abalone - Centre Gare,7.0,"Situé sur l'une des plus belles avenues de la ville, l'hôtel n'est qu'à 5 minutes à pied des monuments romains. ",43.8330273,4.36618969,3,63
Collioure,studio collioure avec wifi à 20 m de la plage,8.4,Managed by a private host,42.527415,3.085054,5,65
Avignon,LE PALAIS DES PAPES - AVIGNONSMILE,9.2,Managed by a private host,43.95130865,4.81073503,2,69
Aix en Provence,Appart-Hypercentre-CLIM-2chbQuartierChic,8.3,"In the heart of Aix-en-Provence, set around 31 km from Marseille Saint-Charles Train Station, Appart-Hypercentre-CLIM-2chbQuartierChic offers free WiFi, air conditioning, and household amenities such...",43.52636334,5.44695853,4,58
Cassis,TERRE MARINE - Bel appartement avec terrasse vue mer,8.6,"Boasting sea views, TERRE MARINE - Bel appartement avec terrasse vue mer offers accommodation with a terrace and a kettle, around less than 1 km from Bestouan. ",43.2169655,5.5295811,7,57
Marseille,"Superbe appart 3 p, 10 mn de la plage avec piscine et parking",9.0,Managed by a private host,43.2505303,5.3814817,7,58
Uzès,Boutique Hôtel Entraigues,8.8,"Set in Uzès in the Languedoc-Roussillon Region, 32 km from Avignon, Boutique Hôtel Entraigues features an outdoor pool. The hotel has a sun terrace and views of the city. ",44.01246437,4.42180011,2,68
Cassis,Le Corton - 45m2 - Parking - Jardin - Wifi,10.0,Managed by a private host,43.211712,5.5416742,7,57
Cassis,Appartement avec jardin et parking,8.9,Managed by a private host,43.212567,5.542724,7,57
Cassis,LA FALAISE PARADIS Vue mer 180°,7.7,"LA FALAISE PARADIS Vue mer 180° is a beachfront property situated in Cassis, 1.1 km from Anse de Corton Beach and 1.4 km from Arene. ",43.21529502,5.54623054,7,57
Cassis,Au son des Cigales,9.0,Managed by a private host,43.21508678,5.53094902,7,57
Cassis,AU BORD DE L'EAU Studio climatisé avec Terrasse et vue mer à 40m de la plage,9.1,Managed by a private host,43.21270692,5.53025561,7,57
Cassis,LE SEPT charmant studio aux portes des calanques,9.7,Managed by a private host,43.2175997,5.53235,7,57
Cassis,Home Cassis - Maison Julou - Piscine chauffée,7.6,"Home Cassis - Maison Julou - Piscine chauffée has garden views, free WiFi and free private parking, set in Cassis, 1.4 km from Bestouan. ",43.22207969,5.53792695,7,57
Cassis,Appartement Cassis vue mer d'exception,8.6,Managed by a private host,43.21875954,5.54379929,7,57
Cassis,"L’Aiguade, appartement d'exception à Cassis",,Managed by a private host,43.2141154,5.5338211,7,57
Cassis,CALANQUE D'EN VAU,8.7,Managed by a private host,43.21459857,5.53784404,7,57
Cassis,Cassis Ma Vie Là,9.1,Managed by a private host,43.216905,5.541446,7,57
Cassis,CALYPSO,8.2,"CALYPSO is a beachfront property located in Cassis, 700 metres from Bestouan and 1.2 km from Anse de Corton Beach. ",43.21703056,5.53575003,7,57
Cassis,LOU CIGALOU,9.0,Managed by a private host,43.214926,5.532989,7,57
Cassis,Plage & Calanques Cassis,9.7,"Offering city views, Plage & Calanques Cassis is an accommodation located in Cassis, 1.5 km from Grande Mer and 1.9 km from Anse de Corton Beach. ",43.2120018,5.5276305,7,57
Cassis,Superb bright flat with balcony and sea view in Cassis - Welkeys,8.1,"Offering city views, Superb bright flat with balcony and sea view in Cassis - Welkeys is an accommodation located in Cassis, 500 metres from Grande Mer and 1.1 km from Anse de Corton Beach. ",43.21495674,5.5357946,7,57
Cassis,BALCON SUR MER vue mer,7.7,"BALCON SUR MER vue mer is set in Cassis, 600 metres from Bestouan, 700 metres from Grande Mer, and 1.2 km from Anse de Corton Beach. ",43.21589392,5.53476321,7,57
Cassis,Chez Mamouska,8.0,Managed by a private host,43.210575,5.547913,7,57
Cassis,MISTRAL Gagnant,8.2,Managed by a private host,43.21537,5.53719,7,57
Cassis,LE REVE BLEU,8.6,"Situated in Cassis, 1.1 km from Grande Mer and 1.4 km from Bestouan, LE REVE BLEU offers a casino and air conditioning. ",43.2206243,5.540767,7,57
Cassis,Le chemin de belle fille,7.4,Managed by a private host,43.21641033,5.55070017,7,57
Cassis,La douceur de Cassis,9.3,Managed by a private host,43.215009,5.530956,7,57
Marseille,Beautiful flat in Vieux port,8.0,Managed by a private host,43.29253825,5.37886038,7,58
Cassis,SunSet Cassis,9.4,Managed by a private host,43.215456,5.535734,7,57
Cassis,UNE TERRASSE SUR LA MER 3 pers 2 chambres VUE MER,8.5,"Located in Cassis, just 400 metres from Bestouan, UNE TERRASSE SUR LA MER 3 pers 2 chambres VUE MER provides beachfront accommodation with a terrace and free WiFi. ",43.21407197,5.53062182,7,57
Cassis,HPC Suites,9.2,"Offering a shared outdoor pool with a terrace and views of the sea, HPC Suites is situated in a 4000 metres² park in the centre of Cassis. ",43.21644024,5.54174572,7,57
Marseille,Appart'City Confort Marseille Centre Prado Velodrome,7.6,"Appart'City Confort Marseille Centre Prado Velodrome, just 200 metres from Périer Metro Station, which leads directly to the centre of Marseille, The European and Mediterranean Civilisations Museum...",43.2798554,5.390496,7,58
Marseille,The People - Marseille,8.4,"Attractively set in Marseille, The People - Marseille features air-conditioned rooms, a bar, free WiFi and a shared lounge. ",43.301105,5.371282,7,58
Marseille,Golden Tulip Marseille Euromed,7.7,"Situated just 500 metres from Les Terrasses du Port shopping centre in Marseille, Golden Tulip Marseille Euromed boasts sea views as well as free access to a fitness area, indoor pool and sun terrace....",43.30972177,5.36703444,7,58
Marseille,Hôtel Life Marseille VP - Vieux Port,8.3,Hôtel Life Marseille VP - Vieux Port is set in an 18th-century stone building opposite the Vieux Port in Marseille's city centre. ,43.29443608,5.37478209,7,58
Marseille,LE PRIVILIANE - Bel et grand appartement idéalement situé,8.4,"LE PRIVILIANE - Bel et grand appartement idéalement situé in Marseille features accommodation with free WiFi, 2.4 km from Plage des Catalans, 100 metres from Saint-Ferreol Street and less than 1 km...",43.29297191,5.37986534,7,58
Marseille,Loft Luxe Liberté,7.5,"Located in Marseille, 2.9 km from Plage des Catalans and 400 metres from Marseille Saint-Charles Train Station, Loft Luxe Liberté offers free WiFi and air conditioning. ",43.3007918,5.3822154,7,58
Marseille,RENTY Côté Parc Parking inclus,8.6,Managed by a private host,43.28194451,5.39709136,7,58
Marseille,L'Orangeraie et la Palmeraie d'Endoume,8.4,Managed by a private host,43.28729147,5.36458233,7,58
Marseille,Hostel Vertigo Vieux-Port,7.8,"Located in central Marseille, Hostel Vertigo Vieux-Port is just 200 metres from the Vieux Port. Guests have access via a staircase to a quadruple room or a bed in a dormitory. ",43.29139738,5.37193626,7,58
