city,hotel_name,score,description,latitude,longitude,temperature,humidity
Le Havre,Duplex lumineux tout confort,8.0,"Duplex lumineux tout confort in Le Havre offers accommodation with free WiFi, 2.3 km from Le Volcan, 2.4 km from Perret Model Appartment and 2.8 km from Saint-Michel's Church. ",49.4862761,0.131625,5,80
Le Havre,Les gîtes Havrais Bis,7.1,"Located within 1.2 km of Le Havre Beach and 1.4 km of Saint-Michel's Church in Le Havre, Les gîtes Havrais Bis provides accommodation with free WiFi and seating area. ",49.5043976,0.1002814,5,80
Bayeux,La Closerie Teranga,9.1,Managed by a private host,49.27804172,-0.70187662,5,81
Amiens,WHITE HOUSE DHAVERNAS,8.6,Managed by a private host,49.8814696,2.2998714,2,87
Le Havre,Le Petit Vatel,7.1,"Le Petit Vatel is located in l’espace Perret, 500 metres from the city hall in La Havre and 1 km from its train station and ferry harbour. Free Wi-Fi access is provided. ",49.491117,0.10451764,5,80
Paris,UCPA SPORT STATION HOSTEL PARIS,8.0,"Featuring a restaurant, bar and views of city, UCPA SPORT STATION HOSTEL PARIS is set in Paris, 3.1 km from Gare du Nord Metro Station. ",48.898133,2.371142,3,80
Mont Saint Michel,Au Mont Pour Deux,8.3,Managed by a private host,48.61349776,-1.48584455,4,85
Chateau du Haut Koenigsbourg,"The Originals Boutique, Hôtel Le Kastelberg, Obernai",8.1,"The Originals Boutique, Hôtel Le Kastelberg, Obernai is located in the famous Kasterlberg Grand Cru vineyard, at the edge of a forest. Free Wi-Fi is available throughout the hotel and restaurant. ",48.38746927,7.42029369,-3,90
Chateau du Haut Koenigsbourg,LA TOUR des fées,9.5,"Set 23 km from Würth Museum, LA TOUR des fées offers accommodation with a bar, a garden and room service for your convenience. Complimentary WiFi is offered. ",48.39372,7.439759,-3,90
Dijon,Apartment Bonnard - best view in Dijon,8.9,Managed by a private host,47.31902668,5.0375203,0,89
Strasbourg,Cozy Appartement Halles Strasbourg,9.5,Managed by a private host,48.5867897,7.7434983,1,84
Besancon,Spacieux 3 chambres refait à neuf,,Managed by a private host,47.2486019,6.0305178,0,88
Grenoble,Cosy-T1-Gare de Grenoble,9.0,Managed by a private host,45.190343,5.7111216,0,88
Annecy,"Annecy Lake, Luxury top floor apartment by LocationlacAnnecy, LLA Selections",9.0,"Set in a central area of Annecy, Annecy Lake, Luxury top floor apartment by LocationlacAnnecy, LLA Selections offers accommodation with mountain views, just 37 km from Bourget Lake and 42 km from...",45.8958075,6.1294522,-1,93
Chateau du Haut Koenigsbourg,Hotel La Mirabelle,9.0,"Hotel La Mirabelle is located in Rheinhausen, 4 km from the Europa-Park. ",48.22580415,7.71240387,-3,90
La Rochelle,Hôtel François 1er,8.1,"Located in the heart of historic La Rochelle, this hotel is set in a 16th century building just a 5 minute walk from the Old Port and local market. ",46.16091143,-1.15203694,4,81
Bayonne,Appartement T2 avec place de parking,9.0,Managed by a private host,43.47827598,-1.50334341,4,81
La Rochelle,Hotel de Paris,7.6,"The Hotel de Paris is located in the city centre of La Rochelle, in a pedestrian street between Place de Verdun and Place du Marché Just a 5-minute walk from the old port and parks, the hotel offers ...",46.16196911,-1.1511746,4,81
Bayonne,Temporesidence Chateauneuf,7.3,"Located in the Aquitaine region, this residence features modern accommodation with wired internet access and a flat-screen TV with cable channels. The sandy beaches of Biarritz are just 8 km away. ",43.48991068,-1.47314027,4,81
Bayonne,Bayonne en plein cœur Centre Historique 2 chambres,8.9,Managed by a private host,43.4890699,-1.4755226,4,81
Bayonne,Temporesidence Cathedrale,7.9,"Located in Bayonne, Temporesidence Cathedrale is just 2.5 km from the train station and 6 km from Biarritz. It offers spacious apartments and studios with a fully equipped kitchenette. ",43.48954193,-1.47812448,4,81
Bayonne,Pia Baïona,8.6,Managed by a private host,43.4925466,-1.4751766,4,81
Bayonne,Duplex Typique Centre Bayonne,9.2,Managed by a private host,43.489894,-1.473892,4,81
Bayonne,Hôtel Le Bayonne,7.8,"Set in central Bayonne in the Aquitaine region, Hôtel Le Bayonne offers a seasonal, heated outdoor swimming pool. Guests are invited to use the hammam. ",43.4850262,-1.47537053,4,81
Bayonne,Hotel Restaurant Les Genets,7.6,"Located 1.5 km from the A63 motorway outside of Bayonne, Hotel Restaurant Les Genets offers soundproofed guest rooms and local specialities are served in the restaurant. ",43.46494896,-1.49584383,4,81
Bayonne,"2 bedrooms on cosy apartment, balcony on the river",,Managed by a private host,43.4859666,-1.4612818,4,81
Bayonne,Péniche DJEBELLE,9.5,"Featuring a shared lounge, terrace and free WiFi, Péniche DJEBELLE is located in Bayonne, 16 km from Biarritz La Négresse Train Station and 26 km from Saint Jean de Luz Train Station. ",43.496335,-1.473749,4,81
Bayonne,T3 avec sa terrasse ensoleillée,8.8,Managed by a private host,43.50708131,-1.47534745,4,81
Bayonne,jeu de paume,8.9,Managed by a private host,43.4898477,-1.4718019,4,81
Bayonne,Le Petit Nid Douillet de Jéjé,,Managed by a private host,43.49405931,-1.4682464,4,81
Bayonne,Charming flat in a calm street at the historic heart of Bayonne - Welkeys,9.2,"Charming flat in a calm street at the historic heart of Bayonne - Welkeys in Bayonne provides accommodation with free WiFi, 11 km from Biarritz La Négresse Train Station, 21 km from Saint Jean de Luz...",43.4888387,-1.477028,4,81
Bayonne,Boutique Hôtel Un Appart en Ville,8.8,"Situated 12 km from Biarritz La Négresse Train Station and 22 km from Saint Jean de Luz Train Station, Boutique Hôtel Un Appart en Ville in Bayonne features air-conditioned accommodation with views of...",43.4909225,-1.4774412,4,81
Bayonne,Hostel 20 Bayonne,7.8,"Featuring a bar and a shared lounge, Hostel 20 Bayonne is located in Bayonne, 15 km from Biarritz La Négresse Train Station and 25 km from Saint Jean de Luz Train Station. ",43.49535,-1.468753,4,81
Bayonne,Appart'Hôtel Bellevue,8.5,"Set in a garden, Appart'Hôtel Bellevue is located in Bayonne with Saint-Marie Cathedral just 2.4 km from the property. Free private parking and free WiFi access are available on site. ",43.50579423,-1.45608832,4,81
Bayonne,ibis budget Bayonne,7.7,"Located 2 km from Bayonne historic centre and train station, and 8 km from the beaches, ibis budget Bayonne has a 24-hour front desk, free Wi-Fi and free parking. ",43.48908262,-1.45717809,4,81
Bayonne,Beautiful flat with a view on the Nive river in Bayonne - Welkeys,7.0,"Offering free WiFi and city views, Beautiful flat with a view on the Nive river in Bayonne - Welkeys is an accommodation located in Bayonne. ",43.4894916,-1.4740525,4,81
Bayonne,Hotel Loreak,7.9,Hotel Loreak is located 2 km from Bayonne city centre and offers en-suite accommodation with free Wi-Fi internet access and a flat-screen TV. ,43.49349109,-1.45263344,4,81
Bayonne,Parc 709 Bayonne,9.2,Managed by a private host,43.495606,-1.481317,4,81
Bayonne,Maison d'hôtes City Break MIRADOUR,8.7,"Set in Bayonne, Maison d'hôtes City Break MIRADOUR has well-equipped accommodation featuring free WiFi, 12 km from Biarritz La Négresse Train Station and 22 km from Saint Jean de Luz Train Station. ",43.489513,-1.479078,4,81
Bayonne,Hôtel Villa KOEGUI Bayonne,9.0,"Hôtel Villa KOEGUI Bayonne has a restaurant, fitness centre, a bar and shared lounge in Bayonne. This property also provides guests with a terrace. ",43.492371,-1.472588,4,81
Bayonne,Hotel Cote Basque,7.8,"This hotel sits in the heart Bayonne’s historical town, in front of the Saint Esprit bridge. It offers free Wi-Fi and en suite rooms. ",43.49618306,-1.46960109,4,81
Bayonne,Villa la Renaissance,9.2,"Villa la Renaissance offers rooms in Bayonne, 600 metres from Ansot Park and 1.2 km from Saint Marie Cathedral. Featuring room service, this property also provides guests with a terrace. ",43.482321,-1.468164,4,81
La Rochelle,Hôtel Le Yachtman,8.2,"Located in La Rochelle, Le Yachtman features a heated swimming pool and a terrace with views of the harbour. It offers en suite accommodation and is just 500 metres from the train station. ",46.15728365,-1.14996761,4,81
La Rochelle,Hotel de La Paix,7.6,"Located in the heart of the city and footsteps from the old port of La Rochelle, the hotel welcomes you in a genuine 18th century ship owner’s residence Set between the Market Place and Verdun Square...",46.16193939,-1.15085542,4,81
La Rochelle,Un Hotel sur le Port,8.1,"Un Hotel sur le Port is located in the heart of La Rochelle, 5 minutes from the aquarium and the tourist office. Each guest room has a private bathroom, flat-screen TV and Wi-Fi internet. ",46.15612058,-1.1489135,4,81
La Rochelle,Best Western Premier Masqhotel,8.6,"The Best Western Masqhotel is a design hotel located a 5-minute walk from La Rochelle’s Vieux Port. It offers contemporary rooms, a lounge bar and free WiFi. ",46.15483672,-1.14505649,4,81
La Rochelle,Les EcoloGites de la Rochelle,8.2,Managed by a private host,46.1428736,-1.1454589,4,81
La Rochelle,La Suite,8.4,Managed by a private host,46.158813,-1.153734,4,81
La Rochelle,Central Park Hôtel & Spa,8.7,"The 4-star Central Park Hôtel & Spa is situated a 10-minute walk from the heart of La Rochelle, within walking distance from the beach, and next to the Old Harbour. ",46.15891333,-1.16082335,4,81
La Rochelle,5 appartements indépendants situés à mi-chemin entre le Vieux Port et le Pont de l île de Ré,7.9,"Set 2.8 km from L'Espace Encan and 3.3 km from Parc Expo de La Rochelle, Europe offers accommodation in La Rochelle. Europe features views of the sea and is 2.2 km from La Rochelle Grosse Cloche. ",46.16886397,-1.17459647,4,81
La Rochelle,Lagrange Apart'Hotel l’Escale Marine,7.3,"Located in La Rochelle, beside Port des Minimes, this residence offers a covered, heated pool and a well being centre. It is a 5-minute walk from the Aquarium and the Vieux Port. ",46.15107012,-1.15486329,4,81
La Rochelle,Maison des Ambassadeurs,8.6,"Nestled in the heart of La Rochelle and set in an 18th-century building, Maison des Ambassadeurs is just a 5-minute walk from the Old Harbour and offers a 24-hour front desk as well as a concierge...",46.16282553,-1.15110219,4,81
La Rochelle,Hôtel Le Rochelois,7.9,Hôtel Le Rochelois features a seasonal outdoor swimming pool and a tennis court. WiFi is free of charge throughout the property. ,46.15418175,-1.18243652,4,81
La Rochelle,Petite Roche,8.8,"Situated in La Rochelle, 1.4 km from Concurrence and 1 km from La Rochelle Train Station, Petite Roche features city views and free WiFi. ",46.1598788,-1.1464518,4,81
La Rochelle,La Rochelle sur L'eau,9.3,"La Rochelle sur L'eau features sea views, free WiFi and free private parking, located in La Rochelle, 800 metres from Minimes. ",46.14667561,-1.16817349,4,81
La Rochelle,Résidence Pierre & Vacances Centre,7.2,"Located in La Rochelle, this Pierre & Vacances residence is a 5-minute walk from the Old Harbour and 300 metres from the TGV Train Station. It has a heated indoor swimming pool and a terrace. ",46.15576943,-1.14639223,4,81
La Rochelle,ATHOME RESIDENCE ET SPA,8.2,"Situated in La Rochelle, ATHOME RESIDENCE ET SPA features free WiFi, and guests can enjoy a bar, a shared lounge and a garden. ",46.145995,-1.152398,4,81
La Rochelle,HÔTEL DE VILLE 2,8.0,"Offering free WiFi and city views, HÔTEL DE VILLE 2 is an accommodation set in a central area of La Rochelle, just 1.1 km from Concurrence and 1.1 km from La Rochelle Train Station. ",46.1601293,-1.152081,4,81
La Rochelle,Séjours & Affaires La Rochelle Les Minimes,7.5,"The Séjours & Affaires Les Minimes is located in La Rochelle, just a few steps from the harbour and only a 15-minute walk from the train station and the marina. ",46.14584493,-1.15611792,4,81
La Rochelle,Hôtel La Monnaie Art & Spa,8.6,"Ideally set in the historic La Rochelle, this 17th-century building overlooks the old harbour. Hôtel De La Monnaie is decorated by artworks and features a terrace and a wellness centre. ",46.1563008,-1.15810812,4,81
La Rochelle,Le Champlain,8.7,Le Champlain is located opposite Parc Charruyer in the heart of La Rochelle. It offers spacious air-conditioned rooms with flat-screen cable TV and free WiFi. ,46.16357605,-1.1541599,4,81
La Rochelle,Appart'City La Rochelle,7.2,This Appart'city is a 10-minute walk from La Rochelle Train Station and 15 minutes from the Old Port and the Old Town. It offers contemporary accommodation with a seating area and an LCD TV. ,46.15844669,-1.14101171,4,81
La Rochelle,Maisons du Monde Hôtel & Suites - La Rochelle Vieux Port,8.4,Maisons du Monde Hôtel & Suites - La Rochelle Vieux Port is located in La Rochelle on the harbour. It offers free WiFi throughout the entire hotel. ,46.15619304,-1.15443483,4,81
La Rochelle,Hôtel Le Transatlantique - Lycée Hôtelier La Rochelle,8.8,"Located in La Rochelle, 2.5 km from Parc Expo de La Rochelle,  The hotel and catering school property is around 5 km from La Rochelle Grosse Horloge, 1.5 km from Musée Maritime de La Rochelle and 1.8...",46.143734,-1.160263,4,81
Besancon,Le Voyageur,6.7,"Set in Besançon, 500 metres from Besancon Viotte Train Station, 1.1 km from Besançon-Mouillère train station and 5.3 km from Micropolis, Le Voyageur offers accommodation with a terrace and free WiFi. ",47.2477178,6.0270496,0,88
La Rochelle,Hotel La Fabrique,8.4,Hotel La Fabrique offers accommodation in La Rochelle. Guests can enjoy the on-site bar. Rooms come with a flat-screen TV. Hôtel La Fabrique features free WiFi throughout the property. ,46.156155,-1.148583,4,81
Besancon,Appart'Hôtel Luxapparts,8.7,Managed by a private host,47.23733956,6.03551203,0,88
Besancon,"Le Bellevue - Parc, Gare et Vieille ville",,Managed by a private host,47.2459538,6.0230912,0,88
Besancon,Hôtel Fontaine Argent - Centre Ville,8.5,"Hôtel Fontaine Argent - Centre Ville is set in Besançon, 6.6 km from Micropolis and 13 km from Besançon Franche-Comté TGV train station. ",47.246146,6.033186,0,88
Besancon,Contact Hôtel Foch,7.0,"Situated a few steps from the Besançon train station and just 5 minutes from the city centre, the Hotel Foch offers quality comfort at an affordable price This charming hotel provides a panoramic vie...",47.24619696,6.02335095,0,88
Besancon,Hotel Vauban,8.5,"Located in Besançon, Hotel Vauban a 2-minute walk from the Museum of Fine Arts and an 18-minute walk from the Citadel of Besançon. It offers free internet access, a 24-hour front desk and a terrace. ",47.23986296,6.02139884,0,88
Besancon,Brit Hotel Besancon l'Horloge,7.5,"Set in Besançon, 3.2 km from Besancon Viotte Train Station, Brit Hotel Besancon l'Horloge offers accommodation with a bar, free private parking, a shared lounge and a terrace. ",47.26358654,6.05153292,0,88
Besancon,Mercure Besancon Parc Micaud,7.6,This Hotel Mercure is situated in the city centre of Besancon in the casino garden on the Doubs River and opposite the Micaud Park. ,47.24228752,6.03179455,0,88
Besancon,Hotel Restaurant Vesontio,8.5,"Located 5 km from the centre of Besançon and the Musée des Beaux-Arts, Hotel restaurant Vesontio offers an air-conditioned restaurant and a meeting room. Free WiFi is available throughout. ",47.25904854,6.00806236,0,88
Besancon,ATELIER DES REVES - au coeur de Besancon - 88 m2,9.6,Managed by a private host,47.2396698,6.0343043,0,88
Besancon,Zenitude Hôtel-Résidences La City,7.8,This Zenitude Hôtel-Résidences La City is located in Besançon and offers studios and apartments with free WiFi access. It is next to the Doubs River and 2 km from the town’s train station. ,47.23568252,6.0140115,0,88
Besancon,Hotel Régina,7.8,"Featuring a terrace, Hotel Régina is set in the centre of Besançon, close to Besançon-Mouillère train station, Besancon Viotte Train Station and Time museum of Besançon. ",47.23664,6.025664,0,88
Besancon,Hotel Victor Hugo & Spa,8.4,Hotel Victor Hugo & Spa offers accommodation 50 metres from Viotte train station and just 15 minutes' walking distance from the historic city centre of Besançon. Many rooms open onto an inner garden. ,47.24741871,6.02364331,0,88
Besancon,Hotel Restaurant Siatel Chateaufarine,7.8,This hotel is located 7.5 km from the centre of Besançon in the Franche-Comté region and offers free Wi-Fi. Guests are invited to relax on the terrace or use the billiards table in the on-site bar. ,47.21613222,5.94183326,0,88
Besancon,Doubs Hotel - Besançon Ecole Valentin,8.0,Doubs Hotel - Besançon Ecole Valentin is a 3-star hotel with a terrace located in Besançon. The hotel features a shared lounge and free WiFi. ,47.27069957,5.99509656,0,88
Besancon,Zenitude Hôtel-Résidences Les Hauts Du Chazal,7.9,"This residence is located next to the big shopping center Chateaufarineau, only 15 minutes away from the city centre. ",47.22448656,5.95612407,0,88
Besancon,Hotel Du Nord,8.1,"This hotel is set in the heart of Besançon, just 700 metres from the banks of the Doubs River. Guests have free Wi-Fi internet access and are invited to relax in the hotel's lounge bar. ",47.23727603,6.02586955,0,88
Besancon,All Suites Besançon,7.9,"Situated in Besançon, within 3.3 km of Besancon Viotte Train Station and 4.4 km of Besançon-Mouillère train station, All Suites Besançon features accommodation with a garden and free WiFi throughout...",47.25435723,5.99548012,0,88
Besancon,Hôtel Restaurant Spa Le Sauvage,8.8,"Hôtel Restaurant Spa Le Sauvage, formerly the Clarisses Monestary, is located in the historic district of Besançon, 500 metres from the citadel's ancient walls. ",47.23171767,6.02759153,0,88
Besancon,Hôtel de Paris,8.3,"Located in the centre of Besançon, Hôtel de Paris offers contemporary décor, a 24-hour reception and terrace. The Besançon Citadelle is just a 15-minute walk away. Vesoul is 48 km from the property. ",47.23856537,6.02532506,0,88
Besancon,Hôtel AKENA BESANCON,8.5,"Situated in Besançon, 10 km from Micropolis, Hôtel AKENA BESANCON features accommodation with a restaurant, free private parking, a bar and a terrace. ",47.23547525,5.9000854,0,88
Besancon,ibis Styles Besançon,7.8,"Conveniently located in a park, ibis Styles Besançon is a 15-minute walk from the TGV Train Station and the centre of Besançon. It features an outdoor swimming pool with a sun terrace and free Wi-Fi. ",47.25425346,6.0216397,0,88
Besancon,ibis Besançon Centre Ville,8.3,"Located in the old town of Besançon, ibis Besançon Centre Ville is 500 metres from Viotte Train Station and both the Vauban Citadel and the Museum of Fine Arts can be found within a 20-minute walk. ",47.24045605,6.02599533,0,88
Besancon,Best Western Citadelle,8.1,"Best Western Citadelle is situated in Besançon’s historic town centre, a 5-minute walk from the River Doubs and the citadel. It offers free WiFi in the hotel rooms. ",47.231541,6.02658033,0,88
Strasbourg,Médicis Home Strasbourg,8.3,"Our senior residence opens its doors to you. Living at the Villa Médicis Strasbourg means enjoying the good life in a friendly setting, elegant and secure environment to make your old age a beautiful...",48.5732564,7.76572449,1,84
Strasbourg,Résidence La Canopée,8.3,"Résidence La Canopée is located in the Quartier Européen - Orangerie district of Strasbourg, less than 1 km from Strasbourg Christmas Market and a 14-minute walk from Strasbourg Cathedral. ",48.59274972,7.74505986,1,84
Strasbourg,Domitys Les Etoiles d'Argent,9.0,"Offering an indoor pool and a spa and wellness centre, Domitys Les Etoiles d'Argent offers self-catering accommodation set in a Senior Residence located on the outskirts of Strasbourg. ",48.60411391,7.70161988,1,84
Annecy,La petite Venise,8.5,Managed by a private host,45.9014158,6.1239177,-1,93
Annecy,Le 3 de Coeur Annecy,8.6,Managed by a private host,45.89979277,6.12620108,-1,93
Dijon,Hôtel De Paris,7.0,"Just a 5-minute walk from the historic centre of Dijon and 100 metres from the Train Station, Hôtel de Paris features contemporary rooms with free Wi-Fi and a bar with a terrace. ",47.32343058,5.03017455,0,89
Dijon,Campanile Dijon Congrès Clemenceau,8.1,"Located in Dijon, Campanile Dijon Congrès Clémenceau offers air-conditioned guest rooms and free Wi-Fi access throughout. ",47.32874479,5.05931675,0,89
Annecy,le panorama du lac,7.7,Managed by a private host,45.89464468,6.13043418,-1,93
Dijon,Appart’City Dijon – Toison D’or,7.0,Appart'City Dijon - Toison D'or is located 10 minutes from the centre of Dijon in the Toison d’Or Technological Park. It offers 2 and 3-room apartment suites with free WiFi internet access. ,47.35495715,5.03765523,0,89
Dijon,Mercure Dijon Centre Clemenceau,8.0,"Mercure Dijon Centre Clémenceau is a 4-star non-smoking hotel in the city centre of Dijon, opposite the Auditorium and the Convention Centre. ",47.32814395,5.05142838,0,89
Dijon,Oceania Le Jura Dijon,8.4,"The Hôtel Le Jura is located in the city centre, 200 metres from the train station and a 10-minute tram ride from the Palais de Congrès. ",47.3236074,5.03021546,0,89
Strasbourg,Hôtel de l'Europe by HappyCulture,8.1,"Hôtel de l'Europe by HappyCulture provides en suite accommodation in Petite France, the historic pedestrian area of Strasbourg’s city centre and is 500 metres from Notre Dame Cathedral. ",48.582097,7.74293996,1,84
Strasbourg,Le Grand Elsau - WIFI - Parking gratuit - 15 min centre,8.3,Managed by a private host,48.5647302,7.7266134,1,84
Strasbourg,Hotel des Arts - Centre Cathédrale,8.0,Hôtel Des Arts is located in the heart of the pedestrian area in the centre of historical Strasbourg. It offers comfortable accommodation with air conditioning and free Wi-Fi. ,48.58031945,7.75127023,1,84
Strasbourg,"voco Strasbourg Centre - The Garden, an IHG Hotel",8.4,"Boasting a garden and a restaurant, Voco - Strasbourg Centre - The Garden - Garden is set in Strasbourg. With a terrace, the property also features a shared lounge, as well as a bar. ",48.589685,7.739508,1,84
Strasbourg,Ciarus,8.2,"Located in Strasbourg, this hotel is just 600 metres from the Palace of the Rhine and a 15-minute walk from Strasbourg Cathedral. ",48.5893507,7.7475403,1,84
Strasbourg,Residence Inn by Marriott Strasbourg,7.9,"Situated in Strasbourg, 200 metres from Strasbourg Exhibition Centre, Residence Inn by Marriott Strasbourg features air-conditioned accommodation and a bar. ",48.59899457,7.76217318,1,84
Strasbourg,AC Hotel by Marriott Strasbourg,8.9,"Set in Strasbourg, 200 metres from Strasbourg Exhibition Centre, AC Hotel by Marriott Strasbourg offers air-conditioned rooms and a bar. ",48.59900335,7.76195994,1,84
Strasbourg,HANNONG Hotel & Wine Bar,8.6,"The Hannong Hotel is located in the heart of Strasbourg, just a 5-minute walk from the TGV train station, Petite France district and the Cathedral. It offers free Wi-Fi access. ",48.58279611,7.74312839,1,84
Strasbourg,Aparthotel Adagio Access Strasbourg Petite France,8.2,"Located in the city centre, this Aparthotel with a 24-hour reception is just 1.5 km from Strasbourg Cathedral.  Free WiFi access and a fully equipped kitchen are in the modern studios and apartments. ",48.57924766,7.73222588,1,84
Strasbourg,Hôtel Tandem - Boutique Hôtel,9.0,"Located opposite Strasbourg TGV Train Station, this eco-friendly Boutique Hotel is just 1.7 km from the city centre and a 5-minute walk from the picturesque Petite France district. ",48.58383633,7.73494899,1,84
Strasbourg,Citadines Kléber Strasbourg,8.2,"Located next to Place Kléber, this Citadines Apart'hotel is just a 10-minute walk from Strasbourg SNCF Train Station. ",48.58384564,7.74342477,1,84
Strasbourg,Le Grand Hotel,8.2,"Located opposite Strasbourg train station, the Grand Hotel is located a 10-minute walk from the city centre and Place Kléber. It offers a bar, terrace and free Wi-Fi access. ",48.58469688,7.736561,1,84
Strasbourg,"Holiday Inn Express Strasbourg Centre, an IHG Hotel",8.0,"Located a 10-minute walk from Strasbourg’s pedestrian area, Holiday Inn Express Centre offers free internet access and a free buffet continental breakfast. ",48.57154052,7.74525492,1,84
Strasbourg,Avenue de La Paix - L'Exclusif,9.2,"Located in Strasbourg, 500 metres from St. Paul's Church, Avenue de La Paix - L'Exclusif provides accommodation with a garden, free WiFi, a 24-hour front desk, and an ATM. ",48.588792,7.755187,1,84
Strasbourg,Appart'City Strasbourg Centre,7.7,"Conveniently located in the centre of Strasbourg, Appart'City Strasbourg is a 10-minute walk from the train station. ",48.57772068,7.73397669,1,84
Strasbourg,Citadines Eurometropole Strasbourg,8.6,"Situated in Strasbourg, 3.6 km from Zénith de Strasbourg, Citadines Eurometropole Strasbourg features a restaurant, and a spa and wellness centre with a indoor pool, a fitness room and a Turkish bath....",48.60427412,7.70446112,1,84
Strasbourg,145m² city center 4 bedrooms view of the Cathedral,8.0,"Boasting city views, 145m² city center 4 bedrooms view of the Cathedral features accommodation with a balcony and a kettle, around 800 metres from Strasbourg Cathedral. ",48.5804957,7.7563554,1,84
Strasbourg,City Résidence Strasbourg Centre,7.0,City Résidence Strasbourg Centre is located 1 km from Strasbourg Train Station and 1.5 km from La Petite France district in Strasbourg city. ,48.58906194,7.73879863,1,84
Strasbourg,Studio Parc des Contades,9.7,Managed by a private host,48.5928691,7.7591739,1,84
Strasbourg,Séjours & Affaires Strasbourg Kleber,7.9,"This residence offers comfortable, self catering accommodation. It is in a quiet road in the city centre, a 5-minute walk from the historic Petite France district and Strasbourg Cathedral. ",48.58319667,7.74285212,1,84
Strasbourg,City Residence Access Strasbourg,6.9,"Located in Strasbourg within 900 metres of Strasbourg Christmas Market, City Residence Access Strasbourg features accommodation with a TV and a kitchenette. ",48.590014,7.73987,1,84
