city,hotel_name,score,description,latitude,longitude,temperature,humidity
Marseille,"InterContinental Marseille - Hotel Dieu, an IHG Hotel",8.3,"InterContinental Marseille - Hotel Dieu is set in a superb 18th century building in the historic quarter of Marseille, 350 metres from the Old Port. WiFi access is available. ",43.29858167,5.36974624,7,58
Marseille,Ibis Marseille Centre Prefecture,7.1,"Located in the 6th district of Marseille, Ibis Marseille Centre Prefectureoffers free WiFi access and a 24-hour front desk. ",43.29155323,5.38197108,7,58
Marseille,Lovely place near Vieux Port,8.3,"In a central area of Marseille, set within a short distance of Vieux Port Metro station and Joliette Metro Station, Lovely place near Vieux Port offers free WiFi, air conditioning and household...",43.29668,5.376092,7,58
Marseille,Vieux Port République Cannebiére,8.7,Managed by a private host,43.29594971,5.37455259,7,58
Marseille,Bright 3br w AC and terrace near the train station in Marseille Welkeys,7.5,Managed by a private host,43.3029349,5.3785872,7,58
Marseille,Magnifique T5 (12pers) 129m²-Climatisé-Vieux-Port,8.0,Managed by a private host,43.2992713,5.3780468,7,58
Marseille,"Holiday Inn Express Marseille Saint Charles, an IHG Hotel",7.8,Holiday Inn Express Marseille Saint Charles is opposite the train station and a 10-minute walk from the Vieux Port in Marseille’s city centre. It offers en suite rooms and free Wi-Fi. ,43.30272424,5.37933044,7,58
Marseille,Le Plaisir 1827,9.1,Managed by a private host,43.2965388,5.3913738,7,58
Marseille,Marseillement votre,8.3,Managed by a private host,43.30020105,5.38260245,7,58
Marseille,SUD PASSION - Sakakini - calme - 3 chambres - lumineux - fibre,10.0,Managed by a private host,43.299162,5.401543,7,58
Marseille,LE PANIER ENCHANTÉ - Suites & Loft - Terrasse et patio au dessus du Vieux Port,7.9,"Offering garden views, a garden and free WiFi, LE PANIER ENCHANTÉ - Suites & Loft - Terrasse et patio au dessus du Vieux Port offers accommodation ideally located in Marseille, within a short distance...",43.300097,5.367585,7,58
Marseille,Toyoko INN Marseille Saint Charles,7.8,"Set in Marseille, just a 5-minute walk from Marseille Saint Charles Train Station, Toyoko INN Marseille Saint Charles features a garden and free WiFi. The hotel is easily accessible from A7 highway. ",43.304229,5.376624,7,58
Marseille,Cocon au Soleil 1827,8.7,Managed by a private host,43.29654954,5.39145293,7,58
Avignon,Avignon Grand Hotel,8.2,"Avignon Grand Hotel is ideally located just outside the city’s Middle Age walls, just 70 metres from Avignon Central Station. ",43.94254506,4.80436206,2,69
Avignon,Hôtel de l'Horloge,8.2,"This hotel is set in a 19th-century building overlooking the picturesque Place de L'Horloge, in the centre of Avignon. It offers stylish rooms with free WiFi access. ",43.9489672,4.80547249,2,69
Marseille,Maisons du Monde Hôtel & Suites - Marseille Vieux Port,8.4,"Overlooking the Old Port, Maisons du Monde Hôtel & Suites - Marseille Vieux Port is located in the heart of Marseille. It offers modern air-conditioned rooms and free WiFi. ",43.29412372,5.37463993,7,58
Avignon,Best Western Plus Le Lavarin,8.3,"Best Western Hôtel du Lavarin is situated in Avignon and is 2.5 km from the ramparts, the Palais des Papes and the Pont d’Avignon. A fitness room, and an indoor pool are also available on site. ",43.92275766,4.804295,2,69
Avignon,Palais des Papes - Havre de Paix III,9.0,Managed by a private host,43.950855,4.810121,2,69
Avignon,Charme au cœur d'avignon,9.5,Managed by a private host,43.947744,4.80797,2,69
Avignon,Cute and cozy town-house of 130m2 in Avignon,8.3,"In a central area of Avignon, located within a short distance of Avignon Central Station and Papal Palace, Cute and cozy town-house of 130m2 in Avignon offers free WiFi, air conditioning and household...",43.9461414,4.8130876,2,69
Avignon,"Duplex climatisé-Hauteur sous plafond 1,9m-Parking privé gratuit-Netflix-Arrivée autonome !! Duplex-Ceiling height 1,9m-Free private parking-Netflix-Self check in",9.6,Managed by a private host,43.9465116,4.8035118,2,69
Avignon,Hôtel Cloitre Saint Louis Avignon,7.6,"Set in central Avignon, a 15-minute walk from Palais des Papes and Pont d'Avignon, this 16th-century hotel offers an outdoor rooftop pool with a large sun terrace. ",43.9438081,4.80494678,2,69
Avignon,Le Magnan,8.3,"Located in a verdant setting within the ancient city walls, Le Magnan offers free WiFi. It is a 10-minute walk from the Papal Palace. ",43.94362946,4.81217131,2,69
Avignon,Le Clos Saluces,9.9,"Offering a flowered furnished garden and a patio with a fountain, LE CLOS SALUCES is situated in Avignon in the Provence-Alpes-Côte d'Azur Region, 450 metres from the Papal Palace and 950 metres from...",43.9501934,4.81058627,2,69
Avignon,Aparthotel Adagio Access Avignon,7.6,"Aparthotel Adagio Access Avignon is located by the Avignon TGV Train Station, only 10 minutes' drive from the town centre. ",43.92623117,4.78592724,2,69
Avignon,KAROUBA.31,9.5,Managed by a private host,43.9476071,4.8079964,2,69
Avignon,Charming 2br with AC a stone's throw from Les Halles d'Avignon Welkeys,8.5,Managed by a private host,43.9477626,4.8085372,2,69
Avignon,Magnifique duplex vue Palais des Papes près de Pont d'Avignon,9.0,Managed by a private host,43.9527751,4.8053707,2,69
Avignon,N15 - Les Confidences - Chambres d'hôtes,9.6,"Featuring an outdoor pool, a garden and a terrace, N15 - Les Confidences - Chambres d'hôtes is located in Avignon city centre. ",43.95029956,4.81104354,2,69
Avignon,Hôtel Central,7.9,"Located in the heart of the Old Town of Avignon, Hôtel Central offers comfortable guest rooms with free WiFi internet access. A garden and a bar are available on site. ",43.94552496,4.80576083,2,69
Avignon,ApartHotel Sainte-Marthe,7.8,"Located opposite the Université Sainte Marthe, just a 15-minute walk from the Palais des Papes and the historical centre of Avignon, Apart'Hotel Sainte-Marthe offers self-catering apartments and free...",43.94989514,4.81986389,2,69
Avignon,Hôtel Le Bristol,7.9,"Ideally located inside the ramparts in the centre of Avignon, Hôtel Le Bristol offers air-conditioned rooms, a bar, free WiFi and a shared lounge. ",43.94403213,4.80533168,2,69
Avignon,NOUVEAU - LE LIMAS - Quartier HISTORIQUE au COEUR d'AVIGNON,8.8,Managed by a private host,43.9524697,4.8049678,2,69
Avignon,B&B Villa de Margot,9.1,"Just 300 metres from the Pont d'Avignon, this B&B is a 6-minute walk from Avignon’s historic centre. Set in a garden and featuring a terrace, it offers air-conditioned accommodation with free Wi-Fi. ",43.95249614,4.81014222,2,69
Avignon,Elegant 2br with 2 bathrooms and AC close to Les Halles dAvignon Welkeys,8.4,Managed by a private host,43.9488705,4.8095723,2,69
Avignon,Cosy and large flat in the hypercentre of Avignon Provence - Welkeys,9.8,"Cosy and large flat in the hypercentre of Avignon Provence - Welkeys is located in the Avignon City Centre district of Avignon, less than 1 km from Avignon Central Station, 4.9 km from Avignon TGV...",43.9499383,4.8065625,2,69
Aix en Provence,N.8 LIFESTYLE SUITES,9.1,Managed by a private host,43.529989,5.45096,4,58
Avignon,CLIMATISATION-Hypercentre-PARKING-COSY CARNOT-AVIGNONSMILE,8.6,Managed by a private host,43.94917757,4.81083119,2,69
Avignon,Régina Boutique Hotel,8.4,Régina is a hotel located on the main street in Avignon and just a 5-minute walk from the Palais des Papes. ,43.9481658,4.80576485,2,69
Aix en Provence,City Résidence Aix-en-Provence,7.1,"Situated a 10-minute drive from the historic centre, the City Residence Aix-en-Provence provides self-catering apartments and studios with flat-screen satellite TVs and garden views. ",43.5285445,5.42601228,4,58
Aix en Provence,Hotel Cardinal,8.4,"Situated in Aix-en-Provence, within 800 metres of Cours Mirabeau and Saint-Sauveur Cathedral, Hotel Cardinal features rooms with air conditioning and a private bathroom. ",43.5255987,5.4517208,4,58
Aix en Provence,Hôtel Birdy by Happyculture,8.1,"Hôtel Birdy by Happyculture is located a 10-minute drive from Aix-en-Provence, next to an 18-hole golf course. It offers an outdoor swimming pool and has free WiFi throughout the property. ",43.48142972,5.3656143,4,58
Aix en Provence,B&B HOTEL Aix-en-Provence Le Tholonet,7.0,"Featuring free WiFi, B&B Hotel Aix en Provence Le Tholonet is a hotel in Les Artauds, 25 km from Marseille. Free private parking is available on site. ",43.51126943,5.48701439,4,58
Aix en Provence,Odalys City Aix en Provence L'Atrium,6.9,"Located in Aix-en-Provence, at a 10-minute walk from the historical city centre and a 5-minute walk from the shops on the Cours Mirabeau, Odalys City Aix en Provence L'Atrium offers self-catering...",43.52409101,5.45521617,4,58
Aix en Provence,Le jardin de Ponteves,7.6,"Located in the centre of Aix-en-Provence, just 31 km from Marseille Saint-Charles Train Station and 31 km from Joliette Metro Station, Le jardin de Ponteves provides accommodation with city views and...",43.5263325,5.450021,4,58
Aix en Provence,Hôtel de France,7.6,"Located in the heart of Aix-en-Provence, Hôtel de France is situated in a street parallel to Cours Mirabeau only 50 metres from the famous Fontaine de la Rotonde, and offers air conditioned rooms with...",43.52693137,5.44626698,4,58
Aix en Provence,Hôtel Le Mozart,8.3,"Located 500 metres from the Granet Museum, Hôtel Le Mozart offers air-conditioned rooms with free WiFi. It is easily accessed from Motorway A8, a 3-minute drive away. ",43.52191762,5.45787156,4,58
Aix en Provence,Hôtel des Augustins,8.1,"Located just of the famous Cours Mirabeau in the heart of the old town of Aix-en-Provence, Hotel Les Augustins is set within the walls of a 12th-century convent. ",43.52688664,5.44727147,4,58
Aix en Provence,Les Quatre Dauphins,8.2,"Les Quatre Dauphins is a hotel set in a former private mansion in the heart of Aix-en-Provence, just 50 metres away from Quatre Dauphins Square and 350 metres from Cours Mirabeau. ",43.5249088,5.45042306,4,58
Aix en Provence,Campanile Aix-en-Provence Sud - Pont de l'Arc,7.3,"Located in Aix-en-Provence, 3 km from the historical centre and Cours Mirabeau, Campanile Aix-en-Provence Sud - Pont de l'Arc offers air-conditioned rooms with free WiFi. ",43.51191632,5.43665394,4,58
Aix en Provence,Domaine Gaogaia,8.4,"Located 2 km from the village of Les Milles and 8 km from the centre of Aix-en-Provence, Domaine Gaogaia offers hotel accommodation with an outdoor pool, a garden and a terrace. ",43.4964012,5.3943974,4,58
Aix en Provence,Grand Hôtel Roi René Aix en Provence Centre - MGallery,7.8,"Located just a 5-minute walk from Cours Mirabeau and the centre of Aix-en-Provence, Grand Hôtel Roi René Aix en Provence Centre - MGallery is a 4-star hotel featuring a seasonal outdoor pool open from...",43.52332474,5.44972569,4,58
Aix en Provence,Le Concorde,7.8,"Le Concorde is ideally located in the centre of Aix-en-Provence, only a 5-minute walk from the famous Cour Mirabeau and near the Granet Museum. It offers a flowered garden. ",43.52461222,5.45375437,4,58
Aix en Provence,Hôtel Rotonde,8.1,"Hôtel Rotonde is located in central Aix-en-Provence, 5 minutes' walk from the SNCF train station. Free WiFi is provided, together with free on-site parking subject to availability. ",43.52391014,5.44249445,4,58
Aix en Provence,Aquabella Hôtel & Spa,8.4,"Surrounded by a beautiful garden, Aquabella offers Provencal-style rooms and guests have free access to the spa. It is located in central Aix-en-Provence, a short walk from the old town. ",43.5312636,5.44507004,4,58
Aix en Provence,T2 classé 3 étoile au centre du quartier historique,8.7,Managed by a private host,43.52997889,5.44973644,4,58
Aix en Provence,Aparthotel Adagio Aix-en-Provence Centre,8.4,"Ideally located on a peaceful street in the centre of Aix-en-Provence, this residence is a 10-minute walk from the cafés and fountains on Cours Mirabeau. Gare d’Aix-en-Provence is 900 metres away. ",43.52890621,5.44086903,4,58
Aix en Provence,Les Suites du Cours & Spa,9.1,"Set in Aix-en-Provence in Cours Mirabeau, Les Suites du Cours & Spa boasts a spa centre. Saint-Sauveur Cathedral is 600 metres away. Free WiFi is featured throughout the property. ",43.52697234,5.44928754,4,58
Aix en Provence,Renaissance Aix-en-Provence Hotel,8.2,"Located within a 10-minute walk of the centre of Aix-en-Provence, Renaissance Aix-en-Provence Hotel boasts free access to a spa with a heated indoor pool, steam room, fitness room, and 2 treatment...",43.52624048,5.43820493,4,58
Aix en Provence,Hôtel Cézanne Boutique-Hôtel,8.1,This boutique design hotel is located in the centre of Aix-en-Provence and offers 55 rooms. If features a terrace and a lounge. The air-conditioned rooms at the Hotel Cézanne have free WiFi access. ,43.52356201,5.44593707,4,58
Aix en Provence,Hôtel Escaletto,8.2,"This 3-star hotel is located in the centre of Aix-en-Provence, a 1-minute walk from Thermes Sextius thermal baths and 550 metres from Cours Mirabeau. Free WiFi is available. ",43.53004967,5.44414669,4,58
Nímes,Grand Hôtel de Nîmes 4 étoiles,7.4,"The Grand Hôtel de Nîmes is a hotel-restaurant-convention hall complex that welcomes you in Nîmes, only 3 km from the Arena. ",43.81471993,4.34627362,3,63
Aix en Provence,Séjours & Affaires Aix-en-Provence Mirabeau,8.0,This Séjours & Affaires residence is located in Aix-en-Provence near the Cours Mirabeau. It offers furnished studios and free Wi-Fi internet access. ,43.52524078,5.441266,4,58
Nímes,Aren'Loft,,Managed by a private host,43.8337854,4.3602264,3,63
Nímes,Hôtel Le Pré Galoffre,8.3,"Le Pré Galoffre enjoys a quiet, rural setting, a 10-minute drive from central Nimes. It has an outdoor pool and sun terrace and offers free WiFi. ",43.78858215,4.35380258,3,63
Nímes,Résidence Du Golf,8.3,"Right on the Nîmes Vacquerolles golf course, Résidence du Golf offers self-catering studios each with a balcony or terrace and views of the golf course. ",43.85125652,4.30073977,3,63
Nímes,Hotel Majestic,8.4,"Renovated in 2019, Hotel Majestic is located in Nîmes, just 320 metres from the Arenas of Nîmes and the town centre. ",43.83436329,4.36533675,3,63
Nímes,HÔTEL C SUITES chambres spacieuses,7.1,"Offering an outdoor pool, C Suites is a urban resort located in Nîmes just 3 km from the Arenas. ",43.815377,4.345905,3,63
Nímes,Guest House Encantada,9.7,Managed by a private host,43.853052,4.351386,3,63
Nímes,Hôtel De L'Amphithéâtre,8.2,"Located in the pedestrian area of Nîmes historical city centre, Hôtel De L'Amphithéâtre consists of 2 mansions dating from the 17th and 18th centuries. ",43.83581534,4.35914017,3,63
Nímes,Odalys City Nîmes Le Cheval Blanc,7.6,"Odalys City Nîmes Le Cheval Blanc is set in the historic heart of Nimes, opposite the Roman Arena and a 5-minute walk from Nimes Train Station. ",43.83423753,4.3607904,3,63
Nímes,Best Western Marquis de la Baume,7.9,"Located in the centre of the historic town of Nîmes, Hôtel Marquis de la Baume is a 17th-century town house just 3.7 km from Parc Expo Nîmes and 650 metres from Nîmes Arena. Free WiFi is provided. ",43.83959476,4.3610841,3,63
Nímes,Hôtel & Spa Vatel,8.2,"Located a 10-minute drive from Nimes city centre and 15 kilometres from the Nimes-Arles-Camargue Airport, this 4-star resort offers free access to the Vatel’s Spa and fitness centre, where facilities...",43.82057675,4.31912698,3,63
Nímes,Zenitude Hôtel-Résidences Nîmes Centre,6.8,Zenitude Nîmes Centre is an eco-friendly residence located in Nîmes. Parc Expo Nîmes is 1.6 km from the property. Free WiFi is featured. ,43.83249328,4.36785668,3,63
Nímes,Novotel Atria Nimes Centre,7.7,"Located in Nîmes city centre, this hotel is just minutes from the Train Station, the Arènes Roman amphitheatre, and the town’s main square. ",43.83542065,4.36340421,3,63
Nímes,Appart'City Nimes,6.9,"This Appart'City is located in Nîmes, a 20-minute walk from the Arena of Nîmes and the TGV Train Station  It is 500 metres from Le Parnasse Sports Centre and Exhibition Centre. ",43.82158549,4.3645978,3,63
Nímes,Kyriad Nîmes Ouest A9,7.6,"Located a 10-minute drive from the centre of Nîmes, this 3-star hotel is ideally located 2 km from the exit 25 of the A9 motorway. ",43.81470735,4.3448326,3,63
Nímes,Logis NIMOTEL Hôtel Cosy,7.4,"Nimotel is located 1 km from the A9 motorway and a 10-minute drive from central Nimes. It has 24-hour reception, a secure outdoor pool and free WiFi access. ",43.81557635,4.34660353,3,63
Nímes,Twenty's Business Flats Nîmes Trigone,8.1,"Set in Nîmes, Twenty's Business Flats Nîmes Trigone offers accommodation 13 km from Parc Expo Nîmes and 34 km from Arles Amphitheatre. ",43.831504,4.367797,3,63
Nímes,Appart'City Confort Nimes Arenes,8.6,"Appart'City Confort Nimes Arenes is set in the historic centre of Nîmes, a 1-minute walk from the Arena and 300 metres from the train station. Underground public parking is available nearby. ",43.83387353,4.36143396,3,63
Nímes,Mas d'Escattes,9.6,"Located 10 km from Parc Expo Nîmes, Mas d'Escattes provides accommodation with an outdoor swimming pool, a garden and a shared kitchen for your convenience. ",43.870469,4.40491,3,63
Nímes,Maison familiale à Nîmes,8.4,Managed by a private host,43.8336424,4.37809653,3,63
Nímes,La Terra Nostra - Townhouse - Swimming pool,8.1,"Set in Nîmes, within 13 km of Parc Expo Nîmes and 35 km of Arles Amphitheatre, La Terra Nostra - Townhouse - Swimming pool offers accommodation with free WiFi, air conditioning, a garden and a...",43.843197,4.3602624,3,63
Nímes,"Le Pari Nîmois, avec Parking, Centre Ville Arènes",9.5,Managed by a private host,43.83558788,4.36419414,3,63
Uzès,Le trente trois,9.1,"Set in Uzès, 31 km from Parc Expo Nîmes and 38 km from Avignon Central Station, Le trente trois offers city views and free WiFi. ",44.00964195,4.41788524,2,68
Nímes,Roma Divine home cinéma et jardin,9.8,Managed by a private host,43.8354875,4.36488547,3,63
Uzès,Une chambre à Uzès,9.2,Managed by a private host,44.0118323,4.4185005,2,68
Uzès,Au Gré Du Voyage,9.2,Managed by a private host,44.0138602,4.42187353,2,68
Uzès,BEL APPARTEMENT SPACIEUX CENTRE VILLE UZES T3,9.0,Managed by a private host,44.0137,4.4179929,2,68
Uzès,Appartement des amoureux,8.1,Managed by a private host,44.00771258,4.40714631,2,68
Uzès,"Maison d’architecte, vue sublime sur Uzès",9.0,Managed by a private host,44.0094393,4.4205349,2,68
Uzès,Maison de Roche-Uzès Centre Historique L' Ucetia,9.3,Managed by a private host,44.0112246,4.4199226,2,68
Nímes,Royal Hôtel,8.2,"Set in the heart of Nîmes, Royal Hôtel features an on-site restaurant, La Bodéguita, which opens onto Assas Square. ",43.8388151,4.35481846,3,63
Uzès,Le Cherche Midi - Appartement centre historique d'Uzès,9.4,Managed by a private host,44.0127104,4.4185003,2,68
Uzès,Maison des Bouvreuils,9.1,Managed by a private host,44.0117798,4.4063082,2,68
Uzès,Appartement dans Hotel de Flaux,9.2,Managed by a private host,44.01201965,4.41943443,2,68
Uzès,Logis Hotel Restaurant Uzès Pont du Gard,7.7,"Logis Hotel Restaurant Uzès Pont du Gard offers comfortable and well-equipped rooms, just a 10-minute walk from the centre. ",44.00284485,4.41645205,2,68
Uzès,Appartement de charme dans le cœur historique d’Uzès,9.4,Managed by a private host,44.01250536,4.42093049,2,68
Uzès,"Les Canisses, magnifique appartement avec terrasse au cœur d'Uzès",9.7,Managed by a private host,44.0135452,4.4170735,2,68
Uzès,La bohème place aux herbes,9.5,Managed by a private host,44.01167638,4.41908838,2,68
Uzès,Le Pré Aux Cigales,9.7,Managed by a private host,44.01544515,4.40987,2,68
Uzès,Maison De La Bourgade,9.8,Managed by a private host,44.009668,4.418032,2,68
Uzès,Le mazet d'Uzès,7.1,"Located in Uzès, 31 km from Parc Expo Nîmes and 36 km from Avignon Central Station, Le mazet d'Uzès provides accommodation with free WiFi, air conditioning, an outdoor swimming pool and a garden. ",43.99669604,4.42597425,2,68
Uzès,"Uzès Duché luxueux appartement, terrasse privée",,Managed by a private host,44.0125138,4.4199993,2,68
Uzès,Bon Jour Uzès,9.6,Managed by a private host,44.0121968,4.41912483,2,68
Uzès,LE MAS DES OLIVIERS appartement 3 min a pied du centre d'Uzès parking piscine,8.9,Managed by a private host,44.012765,4.414323,2,68
Uzès,Les Olives,7.6,"Set in Uzès, 31 km from Parc Expo Nîmes and 35 km from Avignon Central Station, Les Olives offers accommodation with free WiFi, air conditioning and access to a garden with an outdoor swimming pool. ",43.99579924,4.42739208,2,68
Uzès,Les Gîtes de Cayenne - Gîte Olivia,8.7,Managed by a private host,44.0121786,4.4063181,2,68
Uzès,UZES APPART HOTEL Résidence Le Mas des Oliviers,7.5,Managed by a private host,44.01263259,4.41414893,2,68
Uzès,Résidence La Bastide d'Uzes,8.8,Managed by a private host,44.001412,4.419783,2,68
Saintes Maries de la mer,Maison au bord de mer,9.4,"Offering a terrace and garden view, Maison au bord de mer is located in Saintes-Maries-de-la-Mer, 200 metres from Arenas Beach and 200 metres from Amphora Beach. ",43.45015609,4.42718344,4,65
Saintes Maries de la mer,L'appartement de l'église,8.9,Managed by a private host,43.45155631,4.4282775,4,65
Saintes Maries de la mer,"Appartement Saintes-Maries-de-la-Mer, 2 pièces, 4 personnes - FR-1-475-22",,"Appartement Saintes-Maries-de-la-Mer, 2 pièces, 4 personnes - FR-1-475-22 is situated in Saintes-Maries-de-la-Mer, 500 metres from Arenas Beach, 500 metres from Amphora Beach, and 700 metres from Crin...",43.4531568,4.4261789,4,65
Saintes Maries de la mer,Mangio Fango Hotel et Spa,8.6,"Mangio Fango Hotel et Spa in Saintes-Maries-de-la-Mer has 4-star accommodation with a garden, a terrace and a bar. ",43.45978795,4.42328453,4,65
Saintes Maries de la mer,Oh! Campings La Brise,7.6,"Set in Saintes-Maries-de-la-Mer in the Provence-Alpes-Côte d'Azur region, with Est Beach and Amphora Beach nearby, Oh! Campings La Brise offers accommodation with free private parking. ",43.455801,4.436295,4,65
Saintes Maries de la mer,Le Maset,8.8,"Located just 400 metres from the sandy beach in Saintes-Maries-de-La-Mer, Le Maset is an air-conditioned hotel offering a swimming pool surrounded by sun loungers. ",43.45656073,4.42670293,4,65
Saintes Maries de la mer,Appartement de l'olivier,9.1,Managed by a private host,43.45384869,4.42492882,4,65
Saintes Maries de la mer,Magnificent apartment typical of Saintes-Maries-de-laMer,,"Featuring sea views, Magnificent apartment typical of Saintes-Maries-de-laMer offers accommodation with a balcony and a kettle, around 600 metres from Amphora Beach. ",43.4537206,4.4296668,4,65
Saintes Maries de la mer,Mas des Cabidoules,9.7,"Featuring free WiFi, Mas des Cabidoules offers accommodation in Saintes-Maries-de-la-Mer, 1.9 km from Eglise des Stes Maries. The bed and breakfast has an outdoor pool and views of the lake. ",43.46610858,4.4140926,4,65
Saintes Maries de la mer,Hôtel Les Arcades,8.5,"Just 100 metres from the nearest beach and 400 metres from the church in Saintes-Maries-de-la-Mer, this 2-star hotel offers free WiFi access throughout the property. ",43.4526278,4.43076655,4,65
Saintes Maries de la mer,Hotel Lou Marquès,8.4,"Lou Marquès is located in Les Saintes Maries De La Mer, in Camargue Regional Nature Park.  It offers free WiFi and a sunny terrace and it is just 400 metres from the beaches. ",43.45512494,4.42874014,4,65
Saintes Maries de la mer,Vila De La Mar & Spa,8.0,"Vila De La Mar & Spa is a small hotel featuring modern design located in the centre of Saintes-Maries-de-la-Mer, 100 metres from the beach. ",43.45334531,4.43066597,4,65
Saintes Maries de la mer,Hôtel Le Neptune en Camargue,7.8,"Featuring a terrace, Hôtel Le Neptune en Camargue is located in Saintes-Maries-de-la-Mer in the Provence-Alpes-Côte d'Azur region, 400 metres from Arenas Beach and 500 metres from Amphora Beach. ",43.452127,4.425347,4,65
Saintes Maries de la mer,Le Mas de Cocagne,8.6,"Le Mas de Cocagne features a seasonal heated outdoor swimming pool and a garden. It is located at the entrance of Saintes-Maries-de-la-Mer, just 800 metres from the sandy beaches and the town centre. ",43.45831608,4.42523181,4,65
Saintes Maries de la mer,Résidence La Palma,8.1,Résidence La Palma is located in Saintes-Maries-de-la-Mer just 100 metres from the beach and village centre. ,43.45105644,4.42515671,4,65
Saintes Maries de la mer,Auberge Cavaliere du Pont des Bannes,7.3,"Situated in a quiet natural environment in Saintes-Maries-de-la-Mer, Auberge Cavaliere du Pont des Bannes offers comfortable rooms, 2 outdoor swimming pools, a spa area with a sauna and hot tub, a...",43.46542981,4.41963136,4,65
Saintes Maries de la mer,Hotel Camille,7.9,"This air-conditioned hotel featuring a terrace is located on the beachfront in Saintes-Maries-de-la-Mer, 35 km from Arles. Free Wi-Fi access and an LCD TV are offered in the modern rooms. ",43.45039148,4.42991227,4,65
Saintes Maries de la mer,Oh! Campings - Le Clos du Rhône,7.8,"Oh! Campings - Le Clos du Rhône offers accommodation in Saintes-Maries-de-la-Mer, 2.4 km from Eglise des Stes Maries. Set on the beachfront, this property has a restaurant and a bar. ",43.44888,4.40168,4,65
Saintes Maries de la mer,Les Rizières,8.1,"Set by a pond, Les Rizières is a hotel situated 2.8 km from Saintes-Maries-de-la-Mer and 2.4 km from Pont De Gau Ornithological Park with its pink flamingos. ",43.47103999,4.41058695,4,65
Saintes Maries de la mer,L'Estrambord de Camargue,8.4,Managed by a private host,43.452083,4.425598,4,65
Saintes Maries de la mer,Mas des Rièges & Spa,8.8,"Set in Saintes-Maries-de-la-Mer, 1.4 km from Amphora Beach, Mas des Rièges & Spa offers accommodation with an outdoor swimming pool, free private parking, a garden and a terrace. ",43.46150341,4.42932761,4,65
